{
  "schema": "chronicle-entries-v2",
  "checkpoint": "2026-09b",
  "label": "Every story night, 10/20, three more games & the rebuilt runtime",
  "outlook": {
    "next": [
      {
        "title": "S2: the first host-versus-phone state difference",
        "body": "As of full06-input-registration-20260928, the phone's audio has Balloon Boy hopping at the 40.0 s roll of full-06 while the rebuild and the model hold him at CAM 10, and what held him is UNKNOWN. The record leaves S2 open.",
        "sources": ["docs/evidence/full06-input-registration-20260928.json", "plans/ROADMAP.md"]
      },
      {
        "title": "An office trace from the rebuild on the phone",
        "body": "As of recompile-practice-apk-ad92f5548c4cf9a5, the FNaF 2 research rebuild installs and boots on the phone, and no office encounter trace has been collected on it.",
        "sources": ["tools/recompile/results/fnaf2-practice-20260928.json"]
      },
      {
        "title": "FNaF 4 Night 4 and the Fredbear nights",
        "body": "As of fnaf4-nights-1-3-20260925 and fnaf4-night5-n5b-20260927, FNaF 4 Night 4's best attempt died 0.24 s before 6 AM and the first Night 5 died at 38.7 s; the nights toward 20/20/20/20 are played, not seeded.",
        "sources": ["docs/evidence/fnaf4-nights-1-3-20260925.json", "docs/evidence/fnaf4-night5-n5b-20260927.json"]
      }
    ],
    "missing": [
      {
        "title": "Two committed winners with no pack",
        "body": "As of review-promotions-20260929, campaign-night1-minus7-winner.json and campaign-toys-night5-winner.json are MODEL_ONLY winners that no run pack names, and UNTRACKED_WINNER_DEBT is 1 of 1.",
        "sources": ["docs/evidence/review-promotions-20260929.json"]
      },
      {
        "title": "A rate for any binding but k3",
        "body": "The k3 cohort's 8 of 10 is one ten-run measurement of one binding, not a rate for other bindings, and the model predicted no rate for it.",
        "sources": ["docs/evidence/night7-cohort-k3-result-20260918.json"]
      },
      {
        "title": "A promotion path for FNaF 1, 3 and 4",
        "body": "The FNaF 1 4/20 and FNaF 4 story-night 6 AMs record no Plan 12 edge, and the evidence CLI does not read FNaF 1 run records.",
        "sources": ["docs/evidence/fnaf1-420-first-6am-20260925.json", "docs/evidence/fnaf4-nights-1-3-20260925.json"]
      },
      {
        "title": "A FNaF 3 policy that takes every seed",
        "body": "As of fnaf3-stage1-g275-census-20260930, no policy in the FNaF 3 model reaches 6 AM on every seed under the corrected attack-stage rule.",
        "sources": ["docs/evidence/fnaf3-stage1-g275-census-20260930.json"]
      }
    ]
  },
  "entries": [
    {
      "id": "night1-device-clear-dated",
      "date": "2026-09-07",
      "game": "fnaf2",
      "kind": "milestone",
      "title": "Night 1 reached 6 AM on 2026-09-07, not 2026-09-05",
      "body": "The victory record names campaign-2026-09-07T05-05-15.429Z and nine consecutive sixam lifecycle frames from 2026-09-07T05:12:32Z, and it was recorded the same day. The entry night1-device-clear dated this clear 2026-09-05; this entry corrects the date and nothing else: one bounded HID schedule under the minus-toys policy, armed after a verified cam:9+cam:11 split.",
      "measured": "sixam 2026-09-07T05:12:32Z",
      "label": "DEVICE_MEASURED",
      "rung": 3,
      "plan": 12,
      "night": 1,
      "route": "Minus Toys",
      "tags": ["device", "victory", "evidence", "correction"],
      "sources": ["docs/evidence/victory-night1-20260907.json"],
      "status": "standing",
      "supersededBy": null,
      "supersedes": "night1-device-clear"
    },
    {
      "id": "night2-device-clear-dated",
      "date": "2026-09-07",
      "game": "fnaf2",
      "kind": "milestone",
      "title": "Night 2 reached 6 AM on 2026-09-07, not 2026-09-05",
      "body": "The victory record names campaign-2026-09-07T15-40-41.895Z and eleven consecutive sixam lifecycle frames from 2026-09-07T15:47:57Z; the record itself was written on 2026-09-08. The entry night2-device-clear dated this clear 2026-09-05; this entry corrects the date and nothing else: one bounded HID schedule under the minus-toys policy, armed on the first attempt after a verified cam:9+cam:11 split.",
      "measured": "sixam 2026-09-07T15:47:57Z",
      "label": "DEVICE_MEASURED",
      "rung": 3,
      "plan": 12,
      "night": 2,
      "route": "Minus Toys",
      "tags": ["device", "victory", "evidence", "correction"],
      "sources": ["docs/evidence/victory-night2-20260907.json"],
      "status": "standing",
      "supersededBy": null,
      "supersedes": "night2-device-clear"
    },
    {
      "id": "night5-seam-hypothesis-refuted",
      "date": "2026-09-11",
      "game": "fnaf2",
      "kind": "refutation",
      "title": "Moving the Night 5 mask press off the animation seam did not lower the correction rate",
      "body": "The qualification of 2026-09-11 moved the loop mask press from 400 ms to 449 ms after monitor-down and predicted that the CORRECTED gate rate, about 13% over two runs, would fall. It did not: 4 of 16 gates corrected, and the run died in lifecycle static about 157 s in. The seam between the monitor-down animation and the mask press is not what loses that press. Every corrected gate had decided on a frame whose screen the classifier could not identify.",
      "measured": "4/16 corrected",
      "label": "DEVICE_MEASURED",
      "rung": null,
      "plan": 14,
      "night": 5,
      "route": "Minus Toys",
      "tags": ["device", "actuation", "gates"],
      "sources": ["docs/evidence/night5-seam-hypothesis-refuted-20260911.json"],
      "status": "standing",
      "supersededBy": null,
      "supersedes": null
    },
    {
      "id": "night5-mask-deficit-cause-uncertain",
      "date": "2026-09-11",
      "game": "fnaf2",
      "kind": "retraction",
      "title": "The late-repair reading of the Night 5 mask deficit is no longer certain",
      "body": "night5-mask-tick-budget attributed a 0.9 s deficit in corrected mask windows to a repair that arrives 800 ms late. If part of the corrections are spurious, some of those short windows were created by the gate rather than repaired by it. The deficit stays measured and the 800 ms arithmetic stands; the causal reading does not.",
      "measured": null,
      "label": "DEVICE_MEASURED",
      "rung": null,
      "plan": 14,
      "night": 5,
      "route": "Minus Toys",
      "tags": ["device", "gates", "retraction"],
      "sources": ["docs/evidence/night5-seam-hypothesis-refuted-20260911.json", "docs/evidence/night5-mask-tick-budget-20260911.json"],
      "status": "standing",
      "supersededBy": null,
      "supersedes": null
    },
    {
      "id": "night5-mangle-has-no-stun",
      "date": "2026-09-11",
      "game": "fnaf2",
      "kind": "negative",
      "title": "A Night 5 run died to Mangle at 3 AM, and Minus Toys has no stun for her",
      "body": "Mangle killed the run 237.5 s into the night, 2.3 s after the third of three mask corrections in 24 cycles; each correction had found the mask off while the route believed it on. The route has no stun for Mangle by construction, and its one defence is a counter that every parity correction resets. The model scores this exact plan 3000/3000 at epoch 0; the record does not decide whether the model's Mangle is wrong or the phone delivered something the model did not.",
      "measured": "237.5 s",
      "label": "DEVICE_MEASURED",
      "rung": null,
      "plan": 12,
      "night": 5,
      "route": "Minus Toys",
      "tags": ["device", "death", "mangle"],
      "sources": ["docs/evidence/night5-mangle-attribution-20260911.json"],
      "status": "standing",
      "supersededBy": null,
      "supersedes": null
    },
    {
      "id": "night5-first-6am",
      "date": "2026-09-12",
      "game": "fnaf2",
      "kind": "milestone",
      "title": "Night 5 reached 6 AM on the phone",
      "body": "Run night5-anchor2-20260912T204002Z won with 42 of 42 cycle gates AGREED, no corrections and no gate aborts, and the menu then offered 6th Night. The binding is fnv1a-81b5e51c, the contact-final bundle under the minus-toys policy, armed observe-once. One clear, not a rate.",
      "measured": "42/42 gates",
      "label": "DEVICE_MEASURED",
      "rung": null,
      "plan": 12,
      "night": 5,
      "route": "Minus Toys",
      "tags": ["device", "victory", "evidence"],
      "sources": ["docs/evidence/night5-first-6am-20260912.json", "docs/evidence/night5-first-6am-20260912.md", "docs/evidence/runs/night5-anchor2-20260912T204002Z/pack.json"],
      "status": "standing",
      "supersededBy": null,
      "supersedes": null
    },
    {
      "id": "night5-longer-cycle-refuted",
      "date": "2026-09-12",
      "game": "fnaf2",
      "kind": "refutation",
      "title": "A longer Night 5 cycle collapses instead of buying slack",
      "body": "At 3000 seeds the route scores 3000/3000 with a 10000 ms loop and 0/3000 at 15000 ms and at 20000 ms: spacing the mask windows further apart lets an approach complete between them. The period is load-bearing in both directions.",
      "measured": "0/3000",
      "label": "MODEL_ONLY",
      "rung": null,
      "plan": 12,
      "night": 5,
      "route": "Minus Toys",
      "tags": ["model", "census", "strategy"],
      "sources": ["docs/evidence/night5-longer-cycle-refuted-20260912.md"],
      "status": "standing",
      "supersededBy": null,
      "supersedes": null
    },
    {
      "id": "withered-bonnie-death-model-withdrawn",
      "date": "2026-09-12",
      "game": "fnaf2",
      "kind": "retraction",
      "title": "The Withered Bonnie death-cause model failed its first held-out night and was withdrawn",